Title,Price,Rating,Availability
A Light in the ...,£51.77,3,Yes
Tipping the Velvet,£53.74,1,Yes
Soumission,£50.10,1,Yes
Sharp Objects,£47.82,4,Yes
Sapiens: A Brief History ...,£54.23,5,Yes
The Requiem Red,£22.65,1,Yes
The Dirty Little Secrets ...,£33.34,4,Yes
The Coming Woman: A ...,£17.93,3,Yes
The Boys in the ...,£22.60,4,Yes
The Black Maria,£52.15,1,Yes
Starving Hearts (Triangular Trade ...,£13.99,2,Yes
Shakespeare's Sonnets,£20.66,4,Yes
Set Me Free,£17.46,5,Yes
Scott Pilgrim's Precious Little ...,£52.29,5,Yes
Rip it Up and ...,£35.02,5,Yes
Our Band Could Be ...,£57.25,3,Yes
Olio,£23.88,1,Yes
Mesaerion: The Best Science ...,£37.59,1,Yes
Libertarianism for Beginners,£51.33,2,Yes
It's Only the Himalayas,£45.17,2,Yes
In Her Wake,£12.84,1,Yes
How Music Works,£37.32,2,Yes
Foolproof Preserving: A Guide ...,£30.52,3,Yes
Chase Me (Paris Nights ...,£25.27,5,Yes
Black Dust,£34.53,5,Yes
Birdsong: A Story in ...,£54.64,3,Yes
America's Cradle of Quarterbacks: ...,£22.50,3,Yes
Aladdin and His Wonderful ...,£53.13,3,Yes
Worlds Elsewhere: Journeys Around ...,£40.30,5,Yes
Wall and Piece,£44.18,4,Yes
The Four Agreements: A ...,£17.66,5,Yes
The Five Love Languages: ...,£31.05,3,Yes
The Elephant Tree,£23.82,5,Yes
The Bear and the ...,£36.89,1,Yes
Sophie's World,£15.94,5,Yes
Penny Maybe,£33.29,3,Yes
Maude (1883-1993):She Grew Up ...,£18.02,2,Yes
"In a Dark, Dark ...",£19.63,1,Yes
Behind Closed Doors,£52.22,4,Yes
You can't bury them ...,£33.63,2,Yes
Slow States of Collapse: ...,£57.31,3,Yes
Reasons to Stay Alive,£26.41,2,Yes
Private Paris (Private #10),£47.61,5,Yes
#HigherSelfie: Wake Up Your ...,£23.11,5,Yes
Without Borders (Wanderlove #1),£45.07,2,Yes
When We Collided,£31.77,1,Yes
"We Love You, Charlie ...",£50.27,5,Yes
Untitled Collection: Sabbath Poems ...,£14.27,4,Yes
Unseen City: The Majesty ...,£44.18,4,Yes
Unicorn Tracks,£18.78,3,Yes
Unbound: How Eight Technologies ...,£25.52,1,Yes
Tsubasa: WoRLD CHRoNiCLE 2 ...,£16.28,1,Yes
Throwing Rocks at the ...,£31.12,3,Yes
This One Summer,£19.49,4,Yes
Thirst,£17.27,5,Yes
The Torch Is Passed: ...,£19.09,1,Yes
The Secret of Dreadwillow ...,£56.13,1,Yes
The Pioneer Woman Cooks: ...,£56.41,1,Yes
The Past Never Ends,£56.50,4,Yes
The Natural History of ...,£45.22,3,Yes
The Nameless City (The ...,£38.16,4,Yes
The Murder That Never ...,£54.11,3,Yes
The Most Perfect Thing: ...,£42.96,4,Yes
The Mindfulness and Acceptance ...,£23.89,4,Yes
The Life-Changing Magic of ...,£16.77,3,Yes
The Inefficiency Assassin: Time ...,£20.59,5,Yes
The Gutsy Girl: Escapades ...,£37.13,1,Yes
The Electric Pencil: Drawings ...,£56.06,1,Yes
The Death of Humanity: ...,£58.11,4,Yes
The Bulletproof Diet: Lose ...,£49.05,3,Yes
The Art Forger,£40.76,3,Yes
The Age of Genius: ...,£19.73,1,Yes
The Activist's Tao Te ...,£32.24,5,Yes
Spark Joy: An Illustrated ...,£41.83,4,Yes
Soul Reader,£39.58,2,Yes
Security,£39.25,2,Yes
"Saga, Volume 6 (Saga ...",£25.02,3,Yes
"Saga, Volume 5 (Saga ...",£51.04,2,Yes
Reskilling America: Learning to ...,£19.83,2,Yes
"Rat Queens, Vol. 3: ...",£50.40,3,Yes
"Princess Jellyfish 2-in-1 Omnibus, ...",£13.61,5,Yes
Princess Between Worlds (Wide-Awake ...,£13.34,5,Yes
"Pop Gun War, Volume ...",£18.97,1,Yes
"Political Suicide: Missteps, Peccadilloes, ...",£36.28,2,Yes
Patience,£10.16,3,Yes
"Outcast, Vol. 1: A ...",£15.44,4,Yes
orange: The Complete Collection ...,£48.41,1,Yes
Online Marketing for Busy ...,£46.35,1,Yes
On a Midnight Clear,£14.07,3,Yes
Obsidian (Lux #1),£14.86,2,Yes
My Paris Kitchen: Recipes ...,£33.37,2,Yes
Masks and Shadows,£56.40,2,Yes
Mama Tried: Traditional Italian ...,£14.02,4,Yes
"Lumberjanes, Vol. 2: Friendship ...",£46.91,2,Yes
"Lumberjanes, Vol. 1: Beware ...",£45.61,3,Yes
Lumberjanes Vol. 3: A ...,£19.92,2,Yes
"Layered: Baking, Building, and ...",£40.11,1,Yes
Judo: Seven Steps to ...,£53.90,2,Yes
Join,£35.67,5,Yes
In the Country We ...,£22.00,4,Yes
Immunity: How Elie Metchnikoff ...,£57.36,5,Yes
"I Hate Fairyland, Vol. ...",£29.17,2,Yes
I am a Hero ...,£54.63,3,Yes
How to Be Miserable: ...,£46.03,1,Yes
Her Backup Boyfriend (The ...,£33.97,1,Yes
"Giant Days, Vol. 2 ...",£22.11,2,Yes
Forever and Forever: The ...,£29.69,3,Yes
First and First (Five ...,£15.97,4,Yes
Fifty Shades Darker (Fifty ...,£21.96,1,Yes
Everydata: The Misinformation Hidden ...,£54.35,2,Yes
Don't Be a Jerk: ...,£37.97,2,Yes
Danganronpa Volume 1,£51.99,4,Yes
Crown of Midnight (Throne ...,£43.29,3,Yes
"Codename Baboushka, Volume 1: ...",£36.72,4,Yes
Camp Midnight,£17.08,4,Yes
Call the Nurse: True ...,£29.14,5,Yes
Burning,£28.81,3,Yes
Bossypants,£49.46,2,Yes
"Bitch Planet, Vol. 1: ...",£37.92,2,Yes
Avatar: The Last Airbender: ...,£28.09,2,Yes
Algorithms to Live By: ...,£30.81,1,Yes
A World of Flavor: ...,£42.95,1,Yes
"A Piece of Sky, ...",£56.76,5,Yes
A Murder in Time,£16.64,1,Yes
A Flight of Arrows ...,£55.53,5,Yes
A Fierce and Subtle ...,£28.13,4,Yes
A Court of Thorns ...,£52.37,1,Yes
(Un)Qualified: How God Uses ...,£54.00,5,Yes
You Are What You ...,£21.87,4,Yes
William Shakespeare's Star Wars: ...,£43.30,4,Yes
Tuesday Nights in 1980,£21.04,2,Yes
Tracing Numbers on a ...,£41.60,3,Yes
Throne of Glass (Throne ...,£35.07,3,Yes
Thomas Jefferson and the ...,£59.64,1,Yes
Thirteen Reasons Why,£52.72,1,Yes
The White Cat and ...,£58.08,4,Yes
The Wedding Dress,£24.12,1,Yes
The Vacationers,£42.15,4,Yes
The Third Wave: An ...,£12.61,5,Yes
The Stranger,£17.44,4,Yes
The Shadow Hero (The ...,£33.14,1,Yes
The Secret (The Secret ...,£27.37,4,Yes
The Regional Office Is ...,£51.36,5,Yes
The Psychopath Test: A ...,£36.00,2,Yes
The Project,£10.65,1,Yes
The Power of Now: ...,£43.54,2,Yes
The Omnivore's Dilemma: A ...,£38.21,2,Yes
The Nerdy Nummies Cookbook: ...,£37.34,5,Yes
The Murder of Roger ...,£44.10,4,Yes
The Mistake (Off-Campus #2),£43.29,3,Yes
The Matchmaker's Playbook (Wingmen ...,£55.85,1,Yes
The Love and Lemons ...,£37.60,2,Yes
The Long Shadow of ...,£10.97,1,Yes
The Kite Runner,£41.82,4,Yes
The House by the ...,£36.95,1,Yes
The Glittering Court (The ...,£44.28,1,Yes
The Girl on the ...,£55.02,2,Yes
The Genius of Birds,£17.24,1,Yes
The Emerald Mystery,£23.15,2,Yes
The Cookies & Cups ...,£41.25,1,Yes
The Bridge to Consciousness: ...,£32.00,3,Yes
The Artist's Way: A ...,£38.49,5,Yes
The Art of War,£33.34,5,Yes
The Argonauts,£10.93,2,Yes
The 10% Entrepreneur: Live ...,£27.55,3,Yes
Suddenly in Love (Lake ...,£55.99,2,Yes
Something More Than This,£16.24,4,Yes
Soft Apocalypse,£26.12,2,Yes
So You've Been Publicly ...,£12.23,2,Yes
Shoe Dog: A Memoir ...,£23.99,2,Yes
"Shobu Samurai, Project Aryoku ...",£29.06,3,Yes
Secrets and Lace (Fatal ...,£20.27,1,Yes
Scarlett Epstein Hates It ...,£43.55,5,Yes
Romero and Juliet: A ...,£36.94,1,Yes
Redeeming Love,£20.47,5,Yes
Poses for Artists Volume ...,£41.06,1,Yes
Poems That Make Grown ...,£14.19,4,Yes
"Nightingale, Sing",£38.28,1,Yes
Night Sky with Exit ...,£41.05,1,Yes
Mrs. Houdini,£30.25,5,Yes
Modern Romance,£28.26,5,Yes
Miss Peregrine’s Home for ...,£10.76,1,Yes
Louisa: The Extraordinary Life ...,£16.85,2,Yes
Little Red,£13.47,3,Yes
Library of Souls (Miss ...,£48.56,5,Yes
Large Print Heart of ...,£19.15,2,Yes
I Had a Nice ...,£57.36,4,Yes
Hollow City (Miss Peregrine’s ...,£42.98,1,Yes
Grumbles,£22.16,2,Yes
Full Moon over Noah’s ...,£49.43,4,Yes
Frostbite (Vampire Academy #2),£29.99,5,Yes
Follow You Home,£21.36,1,Yes
First Steps for New ...,£29.00,1,Yes
Finders Keepers (Bill Hodges ...,£53.53,5,Yes
"Fables, Vol. 1: Legends ...",£41.62,4,Yes
Eureka Trivia 6.0,£54.59,4,Yes
Drive: The Surprising Truth ...,£34.95,4,Yes
Done Rubbed Out (Reightman ...,£37.72,5,Yes
Doing It Over (Most ...,£35.61,3,Yes
Deliciously Ella Every Day: ...,£42.16,3,Yes
Dark Notes,£19.19,5,Yes
Daring Greatly: How the ...,£19.43,3,Yes
Close to You,£49.46,4,Yes
Chasing Heaven: What Dying ...,£37.80,2,Yes
Big Magic: Creative Living ...,£30.80,3,Yes
Becoming Wise: An Inquiry ...,£27.43,2,Yes
Beauty Restored (Riley Family ...,£11.11,2,Yes
Batman: The Long Halloween ...,£36.50,2,Yes
Batman: The Dark Knight ...,£15.38,5,Yes
Ayumi's Violin,£15.48,2,Yes
Anonymous,£46.82,4,Yes
Amy Meets the Saints ...,£18.46,3,Yes
Amid the Chaos,£36.58,1,Yes
Amatus,£50.54,5,Yes
Agnostic: A Spirited Manifesto,£12.51,5,Yes
Zealot: The Life and ...,£24.70,3,Yes
You (You #1),£43.61,5,Yes
"Wonder Woman: Earth One, ...",£37.34,4,Yes
Wild Swans,£14.36,2,Yes
Why the Right Went ...,£52.65,4,Yes
Whole Lotta Creativity Going ...,£38.20,4,Yes
What's It Like in ...,£19.60,2,Yes
"We Are Robin, Vol. ...",£53.90,1,Yes
Walt Disney's Alice in ...,£12.96,5,Yes
V for Vendetta (V ...,£37.10,4,Yes
Until Friday Night (The ...,£46.31,2,Yes
Unbroken: A World War ...,£45.95,2,Yes
Twenty Yawns,£22.08,2,Yes
Through the Woods,£25.38,2,Yes
This Is Where It ...,£27.12,2,Yes
The Year of Magical ...,£43.04,2,Yes
The Wright Brothers,£56.80,4,Yes
The White Queen (The ...,£25.91,5,Yes
The Wedding Pact (The ...,£32.61,3,Yes
The Time Keeper,£27.88,5,Yes
The Testament of Mary,£52.67,4,Yes
The Star-Touched Queen,£46.02,5,Yes
The Songs of the ...,£44.48,5,Yes
The Song of Achilles,£37.40,5,Yes
The Rosie Project (Don ...,£54.04,1,Yes
The Power of Habit: ...,£16.88,3,Yes
The Marriage of Opposites,£28.08,4,Yes
The Lucifer Effect: Understanding ...,£10.40,1,Yes
The Long Haul (Diary ...,£44.07,1,Yes
The Loney,£23.40,1,Yes
The Literature Book (Big ...,£17.43,3,Yes
The Last Mile (Amos ...,£54.21,2,Yes
The Immortal Life of ...,£40.67,2,Yes
The Hidden Oracle (The ...,£52.26,2,Yes
The Help Yourself Cookbook ...,£28.77,3,Yes
The Guilty (Will Robie ...,£13.82,2,Yes
The First Hostage (J.B. ...,£25.85,3,Yes
The Dovekeepers,£48.78,1,Yes
The Darkest Lie,£35.35,5,Yes
The Bane Chronicles (The ...,£44.73,4,Yes
The Bad-Ass Librarians of ...,£15.77,1,Yes
The 14th Colony (Cotton ...,£39.24,1,Yes
That Darkness (Gardiner and ...,£13.92,1,Yes
Tastes Like Fear (DI ...,£10.69,1,Yes
Take Me with You,£45.21,3,Yes
Swell: A Year of ...,£45.58,1,Yes
Superman Vol. 1: Before ...,£11.89,5,Yes
Still Life with Bread ...,£26.41,3,Yes
Steve Jobs,£39.50,5,Yes
Sorting the Beef from ...,£44.74,4,Yes
Someone Like You (The ...,£52.79,5,Yes
"So Cute It Hurts!!, ...",£35.43,4,Yes
Shtum,£55.84,4,Yes
See America: A Celebration ...,£48.87,3,Yes
salt.,£46.78,4,Yes
Robin War,£47.82,3,Yes
"Red Hood/Arsenal, Vol. 1: ...",£25.48,2,Yes
Rain Fish,£23.57,3,Yes
Quarter Life Poetry: Poems ...,£50.89,5,Yes
Pet Sematary,£10.56,3,Yes
"Overload: How to Unplug, ...",£52.15,3,Yes
Once Was a Time,£18.28,2,Yes
Old School (Diary of ...,£11.83,5,Yes
No Dream Is Too ...,£21.95,2,Yes
"Naruto (3-in-1 Edition), Vol. ...",£38.39,2,Yes
My Name Is Lucy ...,£41.56,1,Yes
My Mrs. Brown,£24.48,3,Yes
My Kind of Crazy,£40.36,1,Yes
Mr. Mercedes (Bill Hodges ...,£28.90,1,Yes
More Than Music (Chasing ...,£37.61,2,Yes
Made to Stick: Why ...,£38.85,5,Yes
Luis Paints the World,£53.95,3,Yes
Luckiest Girl Alive,£49.83,3,Yes
Lowriders to the Center ...,£51.51,2,Yes
Love Is a Mix ...,£18.03,1,Yes
Looking for Lovely: Collecting ...,£29.14,5,Yes
Living Leadership by Insight: ...,£46.91,4,Yes
Let It Out: A ...,£26.79,5,Yes
Lady Midnight (The Dark ...,£16.28,5,Yes
"It's All Easy: Healthy, ...",£19.55,1,Yes
Island of Dragons (Unwanteds ...,£29.65,1,Yes
I Know What I'm ...,£25.98,4,Yes
I Am Pilgrim (Pilgrim ...,£10.60,4,Yes
Hyperbole and a Half: ...,£14.75,5,Yes
"Hush, Hush (Hush, Hush ...",£47.02,3,Yes
Hold Your Breath (Search ...,£28.82,1,Yes
Hamilton: The Revolution,£58.79,3,Yes
Greek Mythic History,£10.23,5,Yes
God: The Most Unpleasant ...,£30.03,5,Yes
Glory over Everything: Beyond ...,£45.84,3,Yes
Feathers: Displays of Brilliant ...,£49.05,3,Yes
Far & Away: Places ...,£15.06,4,Yes
Every Last Word,£46.47,3,Yes
Eligible (The Austen Project ...,£27.09,3,Yes
El Deafo,£57.62,5,Yes
Eight Hundred Grapes,£14.39,4,Yes
Eaternity: More than 150 ...,£51.75,5,Yes
"Eat Fat, Get Thin",£54.07,2,Yes
Don't Get Caught,£55.35,1,Yes
Doctor Sleep (The Shining ...,£40.12,2,Yes
Demigods & Magicians: Percy ...,£37.51,5,Yes
Dear Mr. Knightley,£11.21,5,Yes
Daily Fantasy Sports,£36.58,1,Yes
Crazy Love: Overwhelmed by ...,£47.72,2,Yes
Cometh the Hour (The ...,£25.01,3,Yes
Code Name Verity (Code ...,£22.13,4,Yes
Clockwork Angel (The Infernal ...,£44.14,1,Yes
City of Glass (The ...,£56.02,4,Yes
City of Fallen Angels ...,£11.23,4,Yes
City of Bones (The ...,£43.28,1,Yes
City of Ashes (The ...,£47.27,1,Yes
Cell,£20.29,4,Yes
Catching Jordan (Hundred Oaks),£50.83,3,Yes
"Carry On, Warrior: Thoughts ...",£31.85,3,Yes
Carrie,£46.23,2,Yes
Buying In: The Secret ...,£37.80,4,Yes
Brain on Fire: My ...,£49.32,5,Yes
Batman: Europa,£32.01,2,Yes
Barefoot Contessa Back to ...,£28.01,1,Yes
Barefoot Contessa at Home: ...,£50.62,5,Yes
Balloon Animals,£17.03,3,Yes
Art Ops Vol. 1,£48.80,3,Yes
Aristotle and Dante Discover ...,£58.14,4,Yes
Angels Walking (Angels Walking ...,£34.20,2,Yes
Angels & Demons (Robert ...,£51.48,3,Yes
All the Light We ...,£29.87,5,Yes
Adulthood Is a Myth: ...,£10.90,2,Yes
Abstract City,£56.37,5,Yes
A Time of Torment ...,£48.35,5,Yes
A Study in Scarlet ...,£16.73,2,Yes
A Series of Catastrophes ...,£56.48,2,Yes
A People's History of ...,£40.79,2,Yes
A Man Called Ove,£39.72,1,Yes
A Distant Mirror: The ...,£14.58,3,Yes
A Brush of Wings ...,£55.51,1,Yes
1491: New Revelations of ...,£21.80,3,Yes
"The Three Searches, Meaning, ...",£13.33,3,Yes
Searching for Meaning in ...,£38.73,1,Yes
Rook,£37.86,4,Yes
My Kitchen Year: 136 ...,£11.53,2,Yes
13 Hours: The Inside ...,£27.06,1,Yes
Will You Won't You ...,£13.86,3,Yes
Tipping Point for Planet ...,£37.55,1,Yes
The Star-Touched Queen,£32.30,5,Yes
The Silent Sister (Riley ...,£46.29,5,Yes
The Midnight Watch: A ...,£26.20,1,Yes
The Lonely City: Adventures ...,£33.26,2,Yes
The Gray Rhino: How ...,£59.15,4,Yes
The Golden Condom: And ...,£39.43,1,Yes
The Epidemic (The Program ...,£14.44,5,Yes
The Dinner Party,£56.54,2,Yes
The Diary of a ...,£59.90,3,Yes
The Children,£11.88,3,Yes
Stars Above (The Lunar ...,£48.05,2,Yes
Snatched: How A Drug ...,£21.21,3,Yes
Raspberry Pi Electronics Projects ...,£49.67,4,Yes
Quench Your Own Thirst: ...,£43.14,1,Yes
Psycho: Sanitarium (Psycho #1.5),£36.97,5,Yes
Poisonous (Max Revere Novels ...,£26.80,3,Yes
One with You (Crossfire ...,£15.71,4,Yes
No Love Allowed (Dodge ...,£54.65,4,Yes
Murder at the 42nd ...,£54.36,4,Yes
Most Wanted,£35.28,3,Yes
"Love, Lies and Spies",£20.55,2,Yes
How to Speak Golf: ...,£58.32,5,Yes
Hide Away (Eve Duncan ...,£11.84,1,Yes
Furiously Happy: A Funny ...,£41.46,4,Yes
Everyday Italian: 125 Simple ...,£20.10,5,Yes
Equal Is Unfair: America's ...,£56.86,1,Yes
Eleanor & Park,£56.51,5,Yes
Dirty (Dive Bar #1),£40.83,4,Yes
Can You Keep a ...,£48.64,1,Yes
Boar Island (Anna Pigeon ...,£59.48,3,Yes
A Paris Apartment,£39.01,4,Yes
A la Mode: 120 ...,£38.77,1,Yes
Troublemaker: Surviving Hollywood and ...,£48.39,2,Yes
The Widow,£27.26,2,Yes
The Sleep Revolution: Transforming ...,£11.68,4,Yes
The Improbability of Love,£59.45,1,Yes
The Art of Startup ...,£21.00,3,Yes
Take Me Home Tonight ...,£53.98,3,Yes
Sleeping Giants (Themis Files ...,£48.74,1,Yes
Setting the World on ...,£21.15,2,Yes
Playing with Fire,£13.71,3,Yes
Off the Hook (Fishing ...,£47.67,3,Yes
Mothering Sunday,£13.34,2,Yes
"Mother, Can You Not?",£16.89,5,Yes
M Train,£27.18,1,Yes
Lilac Girls,£17.28,2,Yes
Lies and Other Acts ...,£45.14,1,Yes
Lab Girl,£40.85,1,Yes
Keep Me Posted,£20.46,4,Yes
It Didn't Start with ...,£56.27,3,Yes
Grey (Fifty Shades #4),£48.49,4,Yes
"Exit, Pursued by a ...",£51.34,4,Yes
Daredevils,£16.34,3,Yes
Cravings: Recipes for What ...,£20.50,3,Yes
Born for This: How ...,£21.59,5,Yes
Arena,£21.36,4,Yes
Adultery,£20.88,5,Yes
A Mother's Reckoning: Living ...,£19.53,3,Yes
A Gentleman's Position (Society ...,£14.75,5,Yes
11/22/63,£48.48,3,Yes
10% Happier: How I ...,£24.57,2,Yes
10-Day Green Smoothie Cleanse: ...,£49.71,5,Yes
Without Shame,£48.27,5,Yes
Watchmen,£58.05,4,Yes
Unlimited Intuition Now,£58.87,4,Yes
Underlying Notes,£11.82,2,Yes
The Shack,£28.03,1,Yes
The New Brand You: ...,£44.05,5,Yes
The Moosewood Cookbook: Recipes ...,£12.34,4,Yes
The Flowers Lied,£16.68,2,Yes
The Fabric of the ...,£55.91,1,Yes
The Book of Mormon,£24.57,3,Yes
The Art and Science ...,£52.98,5,Yes
The Alien Club,£54.40,1,Yes
Suzie Snowflake: One beautiful ...,£54.81,5,Yes
Nap-a-Roo,£25.08,1,Yes
NaNo What Now? Finding ...,£10.41,4,Yes
Modern Day Fables,£47.44,2,Yes
If I Gave You ...,£20.91,1,Yes
"Fruits Basket, Vol. 9 ...",£33.95,4,Yes
Dress Your Family in ...,£43.68,3,Yes
Don't Forget Steven,£33.23,1,Yes
Chernobyl 01:23:40: The Incredible ...,£35.92,2,Yes
Art and Fear: Observations ...,£48.63,4,Yes
A Shard of Ice ...,£56.63,3,Yes
A Hero's Curse (The ...,£50.49,3,Yes
23 Degrees South: A ...,£35.79,2,Yes
Zero to One: Notes ...,£34.06,3,Yes
Why Not Me?,£17.76,1,Yes
When Breath Becomes Air,£39.36,2,Yes
Vagabonding: An Uncommon Guide ...,£36.94,2,Yes
The Unlikely Pilgrimage of ...,£43.62,5,Yes
The New Drawing on ...,£43.02,3,Yes
"The Midnight Assassin: Panic, ...",£28.45,4,Yes
The Martian (The Martian ...,£41.39,2,Yes
The High Mountains of ...,£51.15,1,Yes
The Grownup,£35.88,1,Yes
The E-Myth Revisited: Why ...,£36.91,1,Yes
South of Sunshine,£28.93,1,Yes
Smarter Faster Better: The ...,£38.89,5,Yes
Silence in the Dark ...,£58.33,3,Yes
Shadows of the Past ...,£39.67,5,Yes
Roller Girl,£14.10,5,Yes
Rising Strong,£21.82,3,Yes
Proofs of God: Classical ...,£54.21,1,Yes
Please Kill Me: The ...,£31.19,4,Yes
Out of Print: City ...,£53.64,5,Yes
My Life Next Door ...,£36.39,5,Yes
Miller's Valley,£58.54,2,Yes
Man's Search for Meaning,£29.48,3,Yes
Love That Boy: What ...,£25.06,2,Yes
Living Forward: A Proven ...,£12.55,3,Yes
Les Fleurs du Mal,£29.04,5,Yes
Left Behind (Left Behind ...,£40.72,2,Yes
Kill 'Em and Leave: ...,£45.05,5,Yes
Kierkegaard: A Christian Missionary ...,£47.13,1,Yes
John Vassos: Industrial Design ...,£20.22,4,Yes
I'll Give You the ...,£56.48,1,Yes
I Will Find You,£44.21,1,Yes
Hystopia: A Novel,£21.96,4,Yes
Howl and Other Poems,£40.45,2,Yes
History of Beauty,£10.29,4,Yes
Heaven is for Real: ...,£52.86,2,Yes
Future Shock (Future Shock ...,£55.65,5,Yes
Ender's Game (The Ender ...,£43.64,1,Yes
Diary of a Citizen ...,£28.41,1,Yes
Death by Leisure: A ...,£37.51,4,Yes
Brilliant Beacons: A History ...,£11.45,3,Yes
Brazen: The Courage to ...,£19.22,2,Yes
Between the World and ...,£56.91,4,Yes
Being Mortal: Medicine and ...,£55.06,4,Yes
A Murder Over a ...,£13.20,3,Yes
32 Yolks,£53.63,2,Yes
"""Most Blessed of the ...",£44.48,5,Yes
You Are a Badass: ...,£12.08,3,Yes
Wildlife of New York: ...,£22.14,2,Yes
What Happened on Beale ...,£25.37,5,Yes
Unreasonable Hope: Finding Faith ...,£46.33,2,Yes
Under the Tuscan Sun,£37.33,3,Yes
Toddlers Are A**holes: It's ...,£25.55,1,Yes
The Year of Living ...,£34.72,1,Yes
The Whale,£35.96,4,Yes
The Story of Art,£41.14,4,Yes
The Origin of Species,£10.01,4,Yes
The Great Gatsby,£36.05,4,Yes
The Good Girl,£49.03,3,Yes
The Glass Castle,£16.24,1,Yes
The Faith of Christopher ...,£39.55,1,Yes
The Drowning Girls,£35.67,3,Yes
The Constant Princess (The ...,£16.62,3,Yes
The Bourne Identity (Jason ...,£42.78,4,Yes
The Bachelor Girl's Guide ...,£52.30,5,Yes
The Art Book,£32.34,2,Yes
The 7 Habits of ...,£33.17,4,Yes
Team of Rivals: The ...,£20.12,5,Yes
Steal Like an Artist: ...,£20.90,2,Yes
"Sit, Stay, Love",£20.90,3,Yes
Sister Dear,£40.20,4,Yes
"Shrunken Treasures: Literary Classics, ...",£52.87,3,Yes
"Rich Dad, Poor Dad",£51.74,1,Yes
Raymie Nightingale,£34.41,2,Yes
Playing from the Heart,£32.38,1,Yes
Nightstruck: A Novel,£50.35,4,Yes
Naturally Lean: 125 Nourishing ...,£11.38,5,Yes
Meternity,£43.58,3,Yes
Memoirs of a Geisha,£49.67,3,Yes
Like Never Before (Walker ...,£28.77,2,Yes
Life of Pi,£13.22,4,Yes
Leave This Song Behind: ...,£51.17,5,Yes
King's Folly (The Kinsman ...,£39.61,5,Yes
John Adams,£57.43,4,Yes
How to Cook Everything ...,£46.01,4,Yes
How to Be a ...,£28.25,2,Yes
Good in Bed (Cannie ...,£37.05,5,Yes
"Fruits Basket, Vol. 7 ...",£19.57,1,Yes
For the Love: Fighting ...,£45.13,3,Yes
Finding God in the ...,£46.64,2,Yes
Every Heart a Doorway ...,£12.16,5,Yes
Delivering the Truth (Quaker ...,£20.89,4,Yes
Counted With the Stars ...,£17.97,5,Yes
"Chronicles, Vol. 1",£52.60,2,Yes
Blue Like Jazz: Nonreligious ...,£25.77,1,Yes
Benjamin Franklin: An American ...,£48.19,3,Yes
At The Existentialist Café: ...,£29.93,5,Yes
A Summer In Europe,£44.34,2,Yes
A Short History of ...,£52.40,5,Yes
A Gathering of Shadows ...,£44.81,4,Yes
The Sound Of Love,£57.84,5,Yes
The Rise and Fall ...,£39.67,2,Yes
The Perks of Being ...,£55.02,3,Yes
The Mysterious Affair at ...,£24.80,4,Yes
The Man Who Mistook ...,£59.45,4,Yes
The Makings of a ...,£31.58,2,Yes
The Joy of Cooking,£43.27,4,Yes
The Invention of Wings,£37.34,1,Yes
The Hobbit (Middle-Earth Universe),£17.80,5,Yes
The Great Railway Bazaar,£30.54,1,Yes
The Golden Compass (His ...,£18.77,1,Yes
The God Delusion,£46.85,3,Yes
The Girl You Left ...,£15.79,1,Yes
The Fellowship of the ...,£10.27,2,Yes
The Collected Poems of ...,£15.42,5,Yes
The Barefoot Contessa Cookbook,£59.92,5,Yes
Tell the Wolves I'm ...,£50.96,2,Yes
Ship Leaves Harbor: Essays ...,£30.60,3,Yes
Pride and Prejudice,£19.27,4,Yes
Musicophilia: Tales of Music ...,£46.58,1,Yes
Mere Christianity,£48.51,3,Yes
Me Before You (Me ...,£19.02,1,Yes
In the Woods (Dublin ...,£38.38,2,Yes
In Cold Blood,£49.98,4,Yes
How to Stop Worrying ...,£46.49,5,Yes
Give It Back,£18.32,2,Yes
"Girl, Interrupted",£42.14,3,Yes
Fun Home: A Family ...,£56.59,4,Yes
"Fruits Basket, Vol. 6 ...",£20.96,4,Yes
Deception Point,£40.32,4,Yes
"Death Note, Vol. 6: ...",£36.39,3,Yes
Catherine the Great: Portrait ...,£58.55,4,Yes
Better Homes and Gardens ...,£39.61,3,Yes
An Unquiet Mind: A ...,£21.30,3,Yes
A Year in Provence ...,£56.88,4,Yes
World Without End (The ...,£32.97,4,Yes
"Will Grayson, Will Grayson ...",£47.31,4,Yes
Why Save the Bankers?: ...,£48.67,2,Yes
Where She Went (If ...,£41.73,4,Yes
What If?: Serious Scientific ...,£53.68,4,Yes
Two Summers,£14.64,1,Yes
This Is Your Brain ...,£38.40,1,Yes
The Secret Garden,£15.08,4,Yes
The Raven King (The ...,£30.57,2,Yes
The Raven Boys (The ...,£57.74,4,Yes
The Power Greens Cookbook: ...,£11.05,5,Yes
The Metamorphosis,£28.58,1,Yes
The Mathews Men: Seven ...,£42.91,5,Yes
The Little Paris Bookshop,£24.73,3,Yes
The Hiding Place,£55.91,4,Yes
The Grand Design,£13.76,3,Yes
The Firm,£45.56,3,Yes
The Fault in Our ...,£47.22,1,Yes
The False Prince (The ...,£56.00,5,Yes
The Expatriates,£44.58,2,Yes
The Dream Thieves (The ...,£34.50,1,Yes
The Darkest Corners,£11.33,5,Yes
The Crossover,£38.77,4,Yes
The 5th Wave (The ...,£11.83,2,Yes
Tell the Wind and ...,£45.51,3,Yes
Tell Me Three Things,£41.81,1,Yes
Talking to Girls About ...,£25.15,4,Yes
Siddhartha,£34.22,5,Yes
Shiver (The Wolves of ...,£16.23,5,Yes
Remember Me?,£11.48,3,Yes
Red Dragon (Hannibal Lecter ...,£23.37,3,Yes
Peak: Secrets from the ...,£16.28,2,Yes
My Mother Was Nuts,£31.63,4,Yes
Mexican Today: New and ...,£24.91,5,Yes
Maybe Something Beautiful: How ...,£22.54,1,Yes
Lola and the Boy ...,£23.63,4,Yes
Logan Kade (Fallen Crest ...,£13.12,2,Yes
Last One Home (New ...,£59.98,3,Yes
Killing Floor (Jack Reacher ...,£31.49,4,Yes
Kill the Boy Band,£15.52,5,Yes
Isla and the Happily ...,£48.13,5,Yes
If I Stay (If ...,£38.13,5,Yes
I Know Why the ...,£36.55,2,Yes
Harry Potter and the ...,£23.32,1,Yes
"Fruits Basket, Vol. 5 ...",£16.33,1,Yes
Foundation (Foundation (Publication Order) ...,£32.42,1,Yes
Fool Me Once,£16.96,1,Yes
Find Her (Detective D.D. ...,£22.37,1,Yes
Evicted: Poverty and Profit ...,£42.27,1,Yes
Drama,£38.70,2,Yes
Dracula the Un-Dead,£35.63,5,Yes
Digital Fortress,£58.00,5,Yes
"Death Note, Vol. 5: ...",£52.41,1,Yes
"Data, A Love Story: ...",£32.35,3,Yes
Critique of Pure Reason,£20.75,1,Yes
Booked,£17.49,5,Yes
"Blue Lily, Lily Blue ...",£34.13,5,Yes
Approval Junkie: Adventures in ...,£58.81,5,Yes
An Abundance of Katherines,£10.00,5,Yes
America's War for the ...,£51.22,2,Yes
Alight (The Generations Trilogy ...,£58.59,4,Yes
A Girl's Guide to ...,£31.30,1,Yes
A Game of Thrones ...,£46.42,2,Yes
A Feast for Crows ...,£17.21,4,Yes
A Clash of Kings ...,£10.79,3,Yes
Vogue Colors A to ...,£52.35,4,Yes
The Shining (The Shining ...,£27.88,3,Yes
The Pilgrim's Progress,£50.26,2,Yes
The Perfect Play (Play ...,£59.99,3,Yes
The Passion of Dolssa,£28.32,5,Yes
The Jazz of Physics: ...,£38.71,3,Yes
The Hunger Games (The ...,£29.85,5,Yes
The Hound of the ...,£14.82,2,Yes
The Gunning of America: ...,£16.81,4,Yes
The Geography of Bliss: ...,£28.23,2,Yes
The Demonists (Demonist #1),£52.11,2,Yes
The Demon Prince of ...,£27.88,2,Yes
The Bone Hunters (Lexy ...,£59.71,3,Yes
The Beast (Black Dagger ...,£46.08,5,Yes
Some Women,£13.73,5,Yes
Shopaholic Ties the Knot ...,£48.39,5,Yes
Paper and Fire (The ...,£49.45,5,Yes
Outlander (Outlander #1),£19.67,5,Yes
Orchestra of Exiles: The ...,£12.36,3,Yes
No One Here Gets ...,£20.02,5,Yes
Night Shift (Night Shift ...,£12.75,4,Yes
Needful Things,£47.51,4,Yes
Mockingjay (The Hunger Games ...,£20.44,4,Yes
Misery,£34.79,2,Yes
Little Women (Little Women ...,£28.07,4,Yes
It,£25.01,3,Yes
Harry Potter and the ...,£13.90,3,Yes
Harry Potter and the ...,£24.17,4,Yes
Harry Potter and the ...,£31.63,4,Yes
Harry Potter and the ...,£48.75,5,Yes
Harry Potter and the ...,£14.74,1,Yes
Gone with the Wind,£32.49,3,Yes
God Is Not Great: ...,£27.80,1,Yes
Girl With a Pearl ...,£26.77,1,Yes
"Fruits Basket, Vol. 4 ...",£50.44,4,Yes
Far From True (Promise ...,£34.93,2,Yes
Dark Lover (Black Dagger ...,£12.87,1,Yes
